{
  "version": 1,
  "rootId": "c-cur-recur",
  "root": "recur\u590d\u73b0\uff1b\u590d\u53d1",
  "meaning": "",
  "descriptionCn": "",
  "updatedAt": "2026-04-15",
  "words": [
    {
      "id": "c-cur-recur-recurrence",
      "word": "recurrence",
      "display": "Recurrence",
      "phonetic": "",
      "translation": "\u91cd\u73b0\uff1b\u56de\u60f3",
      "sentence": "",
      "tags": [
        "root-family"
      ],
      "level": 1
    },
    {
      "id": "c-cur-recur-recurrent",
      "word": "recurrent",
      "display": "Recurrent",
      "phonetic": "",
      "translation": "\u9891\u9891\u53d1\u751f\u7684\uff1b\u5468\u671f\u6027\u7684",
      "sentence": "",
      "tags": [
        "root-family"
      ],
      "level": 1
    }
  ],
  "parentRootId": "c-cur",
  "rootLevel": 3,
  "rootPath": "c>c-cur>c-cur-recur",
  "type": "branch",
  "notes": ""
}
