{
  "version": 1,
  "rootId": "avidity",
  "root": "avidity",
  "meaning": "",
  "descriptionCn": "\u8d2a\u5a6a",
  "updatedAt": "2026-04-15",
  "words": [
    {
      "id": "avidity",
      "word": "avidity",
      "display": "Avidity",
      "phonetic": "",
      "translation": "\u8d2a\u5a6a",
      "sentence": "",
      "tags": [
        "root-family"
      ],
      "level": 1
    }
  ],
  "parentRootId": "avid",
  "rootLevel": 4,
  "rootPath": "a>avi>avid>avidity",
  "type": "word-family",
  "notes": "\u6839\u636e \u8bcd\u6839.txt \u6574\u7406"
}
