{
  "version": 1,
  "rootId": "c-other-mouth",
  "root": "c-other-mouth",
  "meaning": "",
  "descriptionCn": "",
  "updatedAt": "2026-04-15",
  "words": [
    {
      "id": "c-other-mouth-cancel",
      "word": "cancel",
      "display": "Cancel",
      "phonetic": "",
      "translation": "\u53d6\u6d88\uff1b\u5212\u6389",
      "sentence": "",
      "tags": [
        "root-family"
      ],
      "level": 1
    },
    {
      "id": "c-other-mouth-cater",
      "word": "cater",
      "display": "Cater",
      "phonetic": "",
      "translation": "\u6ee1\u8db3\uff1b\u8fce\u5408",
      "sentence": "",
      "tags": [
        "root-family"
      ],
      "level": 1
    },
    {
      "id": "c-other-mouth-ceremony",
      "word": "ceremony",
      "display": "Ceremony",
      "phonetic": "",
      "translation": "\u5178\u793c",
      "sentence": "",
      "tags": [
        "root-family"
      ],
      "level": 1
    },
    {
      "id": "c-other-mouth-chat",
      "word": "chat",
      "display": "Chat",
      "phonetic": "",
      "translation": "\u804a\u5929",
      "sentence": "",
      "tags": [
        "root-family"
      ],
      "level": 1
    },
    {
      "id": "c-other-mouth-cheat",
      "word": "cheat",
      "display": "Cheat",
      "phonetic": "",
      "translation": "\u6b3a\u9a97",
      "sentence": "",
      "tags": [
        "root-family"
      ],
      "level": 1
    },
    {
      "id": "c-other-mouth-cheer",
      "word": "cheer",
      "display": "Cheer",
      "phonetic": "",
      "translation": "\u6b22\u547c",
      "sentence": "",
      "tags": [
        "root-family"
      ],
      "level": 1
    },
    {
      "id": "c-other-mouth-chew",
      "word": "chew",
      "display": "Chew",
      "phonetic": "",
      "translation": "\u5480\u56bc",
      "sentence": "",
      "tags": [
        "root-family"
      ],
      "level": 1
    },
    {
      "id": "c-other-mouth-cite",
      "word": "cite",
      "display": "Cite",
      "phonetic": "",
      "translation": "\u5f15\u7528\uff1b\u5f15\u8bc1",
      "sentence": "",
      "tags": [
        "root-family"
      ],
      "level": 1
    }
  ]
}
