{
  "version": 1,
  "rootId": "aqueduct",
  "root": "aqueduct",
  "meaning": "",
  "descriptionCn": "\u6c9f\u6e20\uff1b\u5bfc\u6c34\u7ba1",
  "updatedAt": "2026-04-15",
  "words": [
    {
      "id": "aqueduct-aqueduct-2",
      "word": "aqueduct",
      "display": "Aqueduct",
      "phonetic": "",
      "translation": "\u6c9f\u6e20\uff1b\u5bfc\u6c34\u7ba1",
      "sentence": "",
      "tags": [
        "root-family"
      ],
      "level": 1
    }
  ],
  "parentRootId": "aqu",
  "rootLevel": 4,
  "rootPath": "a>a-other>aqu>aqueduct",
  "type": "word-family",
  "notes": "\u6839\u636e \u8bcd\u6839.txt \u6574\u7406"
}
