{
  "version": 1,
  "rootId": "actualize",
  "root": "actualize",
  "meaning": "",
  "descriptionCn": "\u4f7f\u5b9e\u73b0",
  "updatedAt": "2026-04-15",
  "words": [
    {
      "id": "actualize-actualize-2",
      "word": "actualize",
      "display": "Actualize",
      "phonetic": "",
      "translation": "\u4f7f\u5b9e\u73b0",
      "sentence": "",
      "tags": [
        "root-family"
      ],
      "level": 1
    }
  ],
  "parentRootId": "act",
  "rootLevel": 3,
  "rootPath": "a>act>actualize",
  "type": "word-family",
  "notes": "\u6839\u636e \u8bcd\u6839.txt \u6574\u7406"
}
